,Title,Authors,Text,Summary,published_date,Source
0,NSCA Foundation,Asset Media,"New data has revealed that complaints of workplace sexual harassment and discrimination continue to be a concern, with over 800 workers seeking help and 1153 seeking the advice and representation services provided by Legal Aid NSW’s Respect at Work Legal Service (RAWLS) since January 2023. Of those services provided by RAWLS, 71% were for female clients, with the most common complaint being disability discrimination (27%), followed by sexual harassment (20%) and sex discrimination (14%).

The figures come amid increased awareness of sexual harassment because of the #MeToo movement and ongoing efforts to address the issue, including the introduction of a “positive duty” on employers to act to prevent sexual harassment and sex discrimination.

RAWLS solicitor Fiona Pace said that while it is positive that people are getting legal help, the fact that women are still experiencing workplace sex-based discrimination and harassment is a cause for concern. Pace added that the service continues to see women experiencing unwelcome sexual behaviours in the workplace, including assaults and inappropriate comments.

“Sex-based discrimination based on pregnancy or family responsibilities are also common issues we see, with some complaining of losing their job on this basis. The harmful impact of these experiences cannot be overstated. We see clients who experience financial loss from being demoted, losing shifts or their job, or being victimised for complaining. People are also dealing with the mental health impacts and stress,” Pace said.

RAWLS, a free state-side legal service offered by Legal Aid NSW, was established in 2023 to support people experiencing workplace sexual harassment and discrimination. It followed the Respect@Work report, which found that a third of workers, and two in five women, have experienced sexual harassment. Pace said that of the advice provided by RAWLS, 6% was related to racial discrimination. “We know racial discrimination is widespread with 16% of Australians experiencing it, so we really encourage more people to seek help,” Pace said.

The highest number of complaints came from the healthcare and social assistance sector, followed by the professional, scientific and technical sector and accommodation and food services. According to Pace, certain groups like newly arrived migrants, farm workers, young people, Aboriginal people and those from CALD communities are more likely to be affected by discrimination and harassment but are less likely to seek help. “We really encourage people to come forward so we can find the right solution for them to help protect their job and resolve things early on before they escalate,” Pace said.

RAWLS works with other organisations to support clients, including with trauma-informed referral pathways to partner organisations that can provide specialist non-legal support. Legal Aid NSW CEO Monique Hitter said ensuring people can understand and defend their rights in the workplace is essential to address workplace discrimination.

“We know from the Respect@Work report that ensuring people have access to free legal help early on is part of addressing the prevalence of workplace discrimination and sexual harassment. RAWLS has achieved great outcomes for clients. Many workplace complaints have been resolved with clients receiving compensation, apologies from employers and changes to policies or training for staff,” Hitter said.

People can contact RAWLS on (02) 9072 2333 or email: respectatwork@legalaid.nsw.gov.au.

Image credit: iStock.com/kali9","The figures come amid increased awareness of sexual harassment because of the #MeToo movement and ongoing efforts to address the issue, including the introduction of a “positive duty” on employers to act to prevent sexual harassment and sex discrimination.
RAWLS, a free state-side legal service offered by Legal Aid NSW, was established in 2023 to support people experiencing workplace sexual harassment and discrimination.
It followed the Respect@Work report, which found that a third of workers, and two in five women, have experienced sexual harassment.
“We know racial discrimination is widespread with 16% of Australians experiencing it, so we really encourage more people to seek help,” Pace said.
Legal Aid NSW CEO Monique Hitter said ensuring people can understand and defend their rights in the workplace is essential to address workplace discrimination.",,https://www.nscafoundation.org.au/news
1,NSCA Foundation,Asset Media,"Safe Work Australia has published a Psychological Health and Safety in the Workplace report, highlighting the changing impact of work-related psychological injuries in Australia. The report revealed that during 2021–22, mental health conditions accounted for 9% of all serious workers compensation claims, marking a 36.9% increase since 2017–18. The median time lost was more than four times greater than that of all physical injuries and illnesses (2020–21). The median compensation paid for mental health conditions was more than three times greater than that of all physical injuries and illnesses. The report also found that workers with claims for mental health conditions experienced poorer return to work outcomes and were more likely to experience stigma from colleagues and their employers.

Marie Boland, Chief Executive Officer of Safe Work Australia, said the report aims to increase the understanding of the impact of psychosocial hazards at work by providing insights that can help governments, researchers, industry and worker representatives address current and future challenges in psychological health and safety.

“Proactively managing psychosocial hazards at work not only protects workers, it also benefits businesses by improving organisational performance and productivity. Under model work health and safety laws, psychosocial hazards and risks are treated the same as physical hazards and risks,” Boland said.

The data for the report was drawn from Safe Work Australia’s National Dataset for Compensation-based Statistics, the National Return to Work Survey and the People at Work risk assessment survey. Boland said that the report illustrates the importance of Safe Work Australia’s work to support workplaces to understand and meet their work health and safety duties in relation to psychosocial hazards.

Image credit: iStock.com/DSCimage","Safe Work Australia has published a Psychological Health and Safety in the Workplace report, highlighting the changing impact of work-related psychological injuries in Australia.
“Proactively managing psychosocial hazards at work not only protects workers, it also benefits businesses by improving organisational performance and productivity.
Under model work health and safety laws, psychosocial hazards and risks are treated the same as physical hazards and risks,” Boland said.
The data for the report was drawn from Safe Work Australia’s National Dataset for Compensation-based Statistics, the National Return to Work Survey and the People at Work risk assessment survey.
Boland said that the report illustrates the importance of Safe Work Australia’s work to support workplaces to understand and meet their work health and safety duties in relation to psychosocial hazards.",,https://www.nscafoundation.org.au/news
2,NSCA Foundation,Asset Media,"In the first ‘normal’ year post-COVID, Australians are reportedly feeling less connected, valued and included at work; however, organisations focused on diversity and inclusion are bucking the trend, according to a report released by Diversity Council Australia (DCA). The 2023–2024 Inclusion@Work Index captured the state of inclusion and diversity in post-pandemic Australia, drawing comparisons with previous releases in 2021–2022 (during the pandemic) and 2019–2020 (pre-pandemic).

While discrimination, harassment and other forms of workplace exclusion eased off for many workers during the pandemic, data from the 2023–2024 Index shows these trends reversing in post-pandemic workplaces. The data shows that 19% of Australian workers don’t feel valued, respected or able to contribute and progress at work in 2023, a figure that has nearly doubled since 2019.

More workers also feel their manager does not behave in an inclusive way, with 27% reporting their managers did not value differences, treat everyone fairly or deal with inappropriate behaviour — a 9% increase from 2021 (18%) and up 6% from 2019 (21%). Discrimination and harassment are also on the rise, with 30% of workers experiencing discrimination and/or harassment at work in 2023 — up by 8% from 2021 (22%) and 4% higher than the pre-pandemic figure of 26% in 2019.

The report found that D&I active organisations are bucking this trend. Workers who indicated that their organisation is taking action to create a more diverse and inclusive workplace are twice as likely to belong to an inclusive team and have an inclusive manager, and nearly twice as likely to report their work has a positive effect on their mental health. They are also twice as likely to provide excellent customer service, collaborate effectively, solve problems in an innovative way and work extra hard.

DCA CEO Lisa Annese said that although many behave as though the global pandemic is behind us, Australians are still recovering from the shared trauma of the past few years, with workplaces adjusting to the latest ‘new normal’ and grappling with questions around flexible working, AI technology, inflationary pressures and growing skills shortages.

“Meanwhile, employees are still processing the trauma and disruption of the past few years, fuelling a growing disillusionment with traditional working arrangements. With all this in mind, it is unsurprising that DCA’s 2023–2024 Inclusion@Work Index finds workers feeling less connected, valued and included post-pandemic. In a time of so much disruption and division, a focus on diversity and inclusion is more important than ever. This report addresses the unique problems of the post-pandemic workforce and lays out a case for D&I action as a proven solution,” Annese said.

Image credit: iStock.com/interstid","The 2023–2024 Inclusion@Work Index captured the state of inclusion and diversity in post-pandemic Australia, drawing comparisons with previous releases in 2021–2022 (during the pandemic) and 2019–2020 (pre-pandemic).
They are also twice as likely to provide excellent customer service, collaborate effectively, solve problems in an innovative way and work extra hard.
With all this in mind, it is unsurprising that DCA’s 2023–2024 Inclusion@Work Index finds workers feeling less connected, valued and included post-pandemic.
In a time of so much disruption and division, a focus on diversity and inclusion is more important than ever.
This report addresses the unique problems of the post-pandemic workforce and lays out a case for D&I action as a proven solution,” Annese said.",,https://www.nscafoundation.org.au/news
3,NSCA Foundation,Asset Media,"The NSW Government has proposed tougher penalties for employers responsible for industrial manslaughter, including $18 million in fines and lengthy prison sentences. In 2023, the NSW Government announced that it would introduce an industrial manslaughter offence.

The proposed measures are detailed in a consultation paper as the government invites feedback on how to best introduce the new laws and which elements will make up the offence. Industrial manslaughter laws will allow for a business or individual to be held responsible for the death of a person due to negligent or reckless behaviour in the workplace.

The feedback from the survey will be used to inform the government on key elements to include within the NSW Work Health and Safety Act and other relevant considerations for introducing an industrial manslaughter offence in NSW. The paper, developed by SafeWork NSW, provides an overview of what industrial manslaughter is and outlines the offences and penalties that have been implemented in other Australian jurisdictions. NSW is the last mainland state without an industrial manslaughter offence.

Members of the community, including work health and safety experts, business groups, unions, legal stakeholders and families of people who have been killed at work are all encouraged to provide submissions to the consultation paper.

Minister for Work Health and Safety Sophie Cotsis said it is important that the views of members of the community, including businesses, industry, representative bodies and workers, are considered before introducing industrial manslaughter laws. “We never want to have to use these laws. Any workplace death is a tragedy and in cases where a person with a duty of care has been careless or irresponsible, they must be held accountable,” Cotsis said.

To have your say, visit the Have Your Say website.

Image credit: iStock.com/domoyega","The NSW Government has proposed tougher penalties for employers responsible for industrial manslaughter, including $18 million in fines and lengthy prison sentences.
In 2023, the NSW Government announced that it would introduce an industrial manslaughter offence.
Industrial manslaughter laws will allow for a business or individual to be held responsible for the death of a person due to negligent or reckless behaviour in the workplace.
The paper, developed by SafeWork NSW, provides an overview of what industrial manslaughter is and outlines the offences and penalties that have been implemented in other Australian jurisdictions.
NSW is the last mainland state without an industrial manslaughter offence.",,https://www.nscafoundation.org.au/news
4,NSCA Foundation,Asset Media,"A new report from Building Commission NSW has made key recommendations to help boost the number of women working in construction across NSW. The Building Commission NSW Women in Construction Report provides recommendations to increase female participation in the industry and address some of the systemic challenges they face in their careers.

The recommendations provide a roadmap to help address the barriers to attracting and retaining women, addressing negative perceptions, raising business and HR knowledge, and improving workplace culture in the construction industry.

With more than 100,000 construction workers needed to meet the demand for housing supply in NSW, the report highlights the issues that must be addressed to meet productivity aims. Small to medium construction businesses reportedly account for 80% of the industry and employ less than 5% of women, while 35% of these businesses employ no women at all.

The report reveals that 71% of women employed in these businesses have experienced discrimination, with one in two women experiencing sexual harassment. Some small business employers are also reluctant to hire women due to fears of being held legally responsible for any inappropriate behaviour by male employees in the workplace.

The report also found that 42% of male employers perceive the physical demands of the work as too high for women, compared to 13% of female employers. More than 1700 people across NSW participated in the research, representing a cross-section of the community including men, women, students and the general public.

The research report and key findings are available here.

Image credit: iStock.com/FatCamera","A new report from Building Commission NSW has made key recommendations to help boost the number of women working in construction across NSW.
The Building Commission NSW Women in Construction Report provides recommendations to increase female participation in the industry and address some of the systemic challenges they face in their careers.
Small to medium construction businesses reportedly account for 80% of the industry and employ less than 5% of women, while 35% of these businesses employ no women at all.
The report reveals that 71% of women employed in these businesses have experienced discrimination, with one in two women experiencing sexual harassment.
The research report and key findings are available here.",,https://www.nscafoundation.org.au/news
5,NSCA Foundation,Asset Media,"The Australian Council of Trade Unions (ACTU) has revealed that new safety legislation to help improve the safety standards for offshore oil and gas workers has been introduced to parliament. The offshore oil and gas sector involves workers undertaking dangerous tasks in remote and isolated areas. The sector presents significant physical and psychological hazards for workers. To address these issues, the Offshore Petroleum and Greenhouse Gas Storage Legislation Amendment (Safety and Other Measures) Bill 2024 aims to provide stronger protections for offshore oil and gas workers.

The new safety legislation aims to strengthen the role and training of health and safety representatives (HSRs). It also allows HSRs to request a review of safety management documents. The new legislation also aims to improve worker protection against discrimination and coercion, strengthen the mental health protections for workers, improve health and safety rules for diving operations and dive vessels, and simplify the reporting requirements for serious injury notifications.

The government has also announced that it will carry out a review to identify opportunities to harmonise the offshore petroleum safety regime with national work health and safety laws. ACTU Assistant Secretary Liam O’Brien said he welcomed the federal government’s ongoing commitment to improving work health and safety.

“Health and safety representatives play an important role in keeping workplaces safe. Strengthening their role, along with enhancing the protections against discrimination, is vital if safety is going to improve. We also welcome the government’s ambition to harmonise offshore petroleum safety with our national laws. Workers in Commonwealth waters shouldn’t have less protection than those on land. Every worker has a right to safe and healthy work,” O’Brien said.

Image credit: iStock.com/Iam Anupong","The Australian Council of Trade Unions (ACTU) has revealed that new safety legislation to help improve the safety standards for offshore oil and gas workers has been introduced to parliament.
The offshore oil and gas sector involves workers undertaking dangerous tasks in remote and isolated areas.
The new safety legislation aims to strengthen the role and training of health and safety representatives (HSRs).
The government has also announced that it will carry out a review to identify opportunities to harmonise the offshore petroleum safety regime with national work health and safety laws.
ACTU Assistant Secretary Liam O’Brien said he welcomed the federal government’s ongoing commitment to improving work health and safety.",,https://www.nscafoundation.org.au/news
