,Title,Authors,Text,Summary,published_date,Source
111,NSCA Foundation,Asset Media,"The Australian grape and wine sector has faced continuing unprecedented challenges throughout 2021–22. The sharp reduction in exports to mainland China following the imposition of significant deposit tariffs, the ongoing impact of COVID-19, environmental stressors such as floods and hailstorms, conflict in Eastern Europe, rising inflation and capacity issues following a record vintage have created the perfect storm of challenges for the wine industry sector.

On a positive note, towards the end of the 2021–22 financial year have seen the depreciation of the Australian dollar against the United States (US) dollar which assists in making Australian wine more price competitive, particularly in the US market.

In response to these myriad challenges, Mental Health & Wellbeing is a primary focus of the newly released AR Interactive — Wine Producers Guide to Safety 2023 produced in conjunction with industry partnering Association Australian Grape & Wine and endorsed by the NSCA Foundation to provide tools and resources to enable those persons conducting a business or undertaking (PCBU) to take a prevention-led strategic approach to managing mental health and wellbeing, and build capacity for a productive mentally healthy workplace that supports workers and helps break the stigma and discrimination that often surround this topic.

This focus is particularly in light of the model work health and safety (WHS) laws which now include regulations on psychosocial hazards and a new model Code of Practice Managing Psychosocial Hazards at Work. This guide is an overview of the Australian mental health workforce policy landscape, which varies across jurisdictions, however has commonalities in its aims and principles, as mental injury claims continue to increase.

Designed to be displayed in the workplace for toolbox meetings and/or regular WHS meetings and conversation, the Wine Producers Guide to Safety 2023 is developed with interactive augmented reality (AR) capabilities for use with a smart device, by simply downloading the free Pro-Vis AR Safety App via the App Store or Google Play. This leading-edge digitally interactive Guide is a targeted response to a changed landscape as workers often respond well to information relayed via visual means such as videos and 3D animations rather than technical written documents, and so is a highly effective communication tool. Available via free subscription at www.provisual.com.au. Free mental health support resources include:

Farmers and Mental Health video

Rural and Remote Mental Health — Rural Minds

Safe Work SA — Top 10 Tips to Maintain Your Mental Health

Together Pro-Visual Publishing in consultation with Australian Grape & Wine have carefully identified high-risk hazards and risks following in-depth sector feedback which includes:

Contractor Management Safety: The agricultural sector is one of the most hazardous with statistics showing the highest work-related injury fatalities of any industry — 10.4% fatalities per 100,000 workers*. A PCBU has the same WHS duties and obligations for on-site contractors and seasonal workers, especially in light of the Agriculture Visa legislation, as with their own workers. Download Pro-Vis AR Safety App to access Safe Work SA Farmers’ Guidebook to WHS.

Working in Heat: Risk Assessment; Control Measures and Heat Related Illness Symptoms. Downloadable resources via Pro-Vis Safety App include:

Safe Work Australia Solar Ultraviolet Radiation Managing the Risks Fact Sheet & Managing the Risks of Working in Heat Guidance Material

First Aid Fact Sheet

Cancer Council SunSmart App

Confined Spaces: Risk Assessment & Control Measures; Entering & Exiting; Communication & Safety Monitoring; Respiratory Protective Equipment; Emergency Procedures.

Free resource via Pro-Vis AR Safety App: Confined Spaces Criteria

APVMA updated Spray Drift Policy and Minimising the hazardous effects of Spray Drift. Downloadable resources via Pro-Vis AR Safety App include:

Grains Research and Development Corp (GRDC) — Preventing Off-target Spray Drift & Weather Essentials for Pesticide Application Video

Bureau of Meteorology (BOM) Weather for Pesticide Spraying

NSW DPI Agriculture Early Season Vineyard Spray Considerations Video

Machinery Safety: Preventing Machinery Entanglement and Guarding. Downloadable resources via Pro-Vis AR Safety App include:

Workplace Safety & Prevention Services: Preventing Machinery Entanglement Video

Safe Work Australia Machinery Guarding Video

Pro-Visual Publishing, CEO John Hutchings states, “Mental Health and Wellbeing is just as important as the physical health and safety viewed through the framework of risk management, protecting all workers from psychological workplace hazards. Preventing psychological harm is an essential part of creating a healthy and safe workplace. On average, work-related psychological injuries have longer recovery times, higher costs, and require more time away from work when compared with physical injuries.

“This vital free Workplace Safety initiative would not be possible without the ongoing support from our Corporate Sponsors and Australian Grape & Wine.”

For free Guides email: marketing@provisual.com.au or visit: https://www.provisual.com.au/free-guide-subscription.html.

*Safe Work Australia key WHS statistics 2022 — Agriculture, Forestry & Fishing.

Click here for clearer image.","On a positive note, towards the end of the 2021–22 financial year have seen the depreciation of the Australian dollar against the United States (US) dollar which assists in making Australian wine more price competitive, particularly in the US market.
This focus is particularly in light of the model work health and safety (WHS) laws which now include regulations on psychosocial hazards and a new model Code of Practice Managing Psychosocial Hazards at Work.
This guide is an overview of the Australian mental health workforce policy landscape, which varies across jurisdictions, however has commonalities in its aims and principles, as mental injury claims continue to increase.
Download Pro-Vis AR Safety App to access Safe Work SA Farmers’ Guidebook to WHS.
Free resource via Pro-Vis AR Safety App: Confined Spaces CriteriaAPVMA updated Spray Drift Policy and Minimising the hazardous effects of Spray Drift.",,https://www.nscafoundation.org.au/news
112,NSCA Foundation,Asset Media,"The Chamber Wellness Program is a collaboration between the Queensland Government and Business Chamber Queensland to provide support to chambers of commerce and their business networks across Queensland. The program includes the Chamber Wellness Fund and the Business Chamber Queensland online mental health resources for chambers. Chambers from Cairns, Mt Isa and Gold Coast will receive funding of up to $5000 to support small businesses in their local area.

Commerce North West (Mt Isa) will host a Workplace Wellness event to share knowledge and skills related to self-care, stress reduction and healthy living. The Valley Chamber of Commerce, Spring Hill will run meditation sessions followed by breakfast, teaching the importance of relaxation in a busy lifestyle. The LIVINWell Southern Gold Coast Chamber of Commerce project will address the need for small business owners and their staff to feel that they can ask for help and how to ask for help with mental health concerns affecting them, their colleagues or families. The project will educate members on the signs that may indicate they need help and will give them solutions about what to do next. The Sunshine Coast Chambers to receive funding include Nambour, Yandina, Eumundi, Noosa, Caloundra and Marooychydore.

Minister for Employment and Small Business Di Farmer said running a small business can be very rewarding but it can also take its toll on the business owners and employees — when the business is under stress. Farmer said the Chamber Wellness Program will equip local chambers with the skills and resources to tailor mental health wellness initiatives to local small business owners and operators in their region.

“Programs through the package include the appointment of six specialist business wellness coaches across Queensland where they are needed most (Cairns, Townsville, Mackay, North Brisbane, South Brisbane, Toowoomba). Each coach has up to 28 clients at any one time. Interactions with those clients each month can range from physical visits, telephone support as well as support to access other services. Some clients may not need much support for the duration of the engagement with a coach and others will need intensive assistance requiring multiple hours of work,” Farmer said.

Business Chamber Queensland CEO Heidi Cooper said mental health and wellness is a significant priority for Queensland businesses and their workforces with many businesses identifying mental health as a significant issue for workforces going forward.

“It’s why the Chamber Wellness Program is such an important asset for chambers across the state and also the local business communities and workforces which rely on them. This program means chambers can take positive steps to look after, connect and support their business community. Local chambers have a really important role to play in their business communities and we’re so pleased to work with the Queensland Government to empower chambers to promote positive mental health and wellbeing among businesses in every part of Queensland,” Cooper said.

Image credit: iStock.com/interstid","The Chamber Wellness Program is a collaboration between the Queensland Government and Business Chamber Queensland to provide support to chambers of commerce and their business networks across Queensland.
The program includes the Chamber Wellness Fund and the Business Chamber Queensland online mental health resources for chambers.
Chambers from Cairns, Mt Isa and Gold Coast will receive funding of up to $5000 to support small businesses in their local area.
Minister for Employment and Small Business Di Farmer said running a small business can be very rewarding but it can also take its toll on the business owners and employees — when the business is under stress.
Farmer said the Chamber Wellness Program will equip local chambers with the skills and resources to tailor mental health wellness initiatives to local small business owners and operators in their region.",,https://www.nscafoundation.org.au/news
113,NSCA Foundation,Asset Media,"Food delivery workers are at risk of physical and psychological harm at work. Safe Work Australia has launched the ‘Deliver yourself home safely’ campaign to increase the awareness and knowledge of work health and safety for food delivery workers. Safe Work Australia data shows there have been 10 fatalities of food delivery workers since 2019. This is a devastating outcome for these workers and their families, friends and co-workers, as well as the broader community.

The ‘Deliver yourself home safely’ campaign provides food delivery workers with practical information and key contact details to help influence positive work health and safety attitudes and behaviours. Due to the high proportion of food delivery workers who have English as a second language, the campaign will communicate in Mandarin, Punjabi, Nepali, Vietnamese, Hindi and Urdu. All materials will also be available in English.

The campaign website has information on work health and safety risks and hazards, rights and duties, what food delivery workers can do to keep safe, dealing with abuse and extreme weather conditions, work health and safety consultation, and workers’ compensation. The campaign kit has posters, checklists, social media tiles, infographics and fact sheets.

The campaign complements national work health and safety guidance for the food delivery industry published by Safe Work Australia in 2021 to help food delivery riders, platforms and food outlets understand and comply with their duties under work health and safety legislation, identify and manage the relevant risks and hazards and understand how workers’ compensation applies to the gig economy.

Michelle Baxter, Chief Executive Officer of Safe Work Australia, said that all workers, regardless of the work they do or how they are engaged, have a right to a healthy and safe working environment. This includes food delivery workers who encounter a range of hazards in their jobs that pose risks to physical and psychological safety. “It’s important food delivery workers understand what they can do to be safe at work, as well as who they can talk to about work health and safety, so they can get home safely. They are, after all, the most valuable package,” Baxter said.

For more information about the campaign, visit: www.swa.gov.au/deliversafely.

Image credit: iStock.com/NoSystem images","Food delivery workers are at risk of physical and psychological harm at work.
Safe Work Australia has launched the ‘Deliver yourself home safely’ campaign to increase the awareness and knowledge of work health and safety for food delivery workers.
Safe Work Australia data shows there have been 10 fatalities of food delivery workers since 2019.
Due to the high proportion of food delivery workers who have English as a second language, the campaign will communicate in Mandarin, Punjabi, Nepali, Vietnamese, Hindi and Urdu.
This includes food delivery workers who encounter a range of hazards in their jobs that pose risks to physical and psychological safety.",,https://www.nscafoundation.org.au/news
114,NSCA Foundation,Asset Media,"Outdoor workers are reportedly exposed to three times more UV radiation than indoor workers, with the Cancer Institute NSW urging people to take action to reduce their skin cancer risk. The Cancer Institute NSW’s new ‘Change Your Routine’ video campaign warns of the dangers of skin cancer, with supportive resources for workers and employers that model how, when and where to protect their skin at work.

The Chief Cancer Officer for NSW and CEO of Cancer Institute NSW, Professor Tracey O’Brien, said that although UV may not be seen or felt, it is ever-present, even on cool and cloudy days. “It’s a misconception that UV radiation is only harmful during summer, with high UV index levels present in NSW from August to May,” O’Brien said.

According to O’Brien, 95% of melanoma and 99% of non-melanoma skin cancers are caused by overexposure to UV radiation from the sun, and for those working in agriculture, construction and roads, the risk of developing skin cancer is even greater. “Fortunately, most skin cancers can be prevented if we follow the advice that has been drummed into us for decades — when outdoors, slip on protective clothing, slop on SPF 50+ sunscreen, slap on a wide brimmed hat, seek shade and slide on sunglasses. It can truly save lives,” O’Brien said.

Australia reportedly has one of the highest skin cancer rates in the world, with two out of three Australians treated for skin cancer during their lifetime. Not all skin cancers can simply be cut out, with men over 40 years of age 2.5 times more likely to die from melanoma than women of the same age. Professor O’Brien said UV radiation is a major workplace hazard and employers have a duty of care to protect their workers.

“There are simple measures employers can take to protect their staff, like setting up shade areas using gazebos or awnings, attaching sun protection to helmets, providing employees with sunscreen and breathable full-length work wear, and ensuring workers follow other sun safety measures,” O’Brien said.

Construction worker Corey Jane, 29, has had 20 skin cancers removed from almost every part of his body. He urged fellow outdoor workers to make sun protection part of their daily routine. “My attitude towards sun safety since my diagnosis has changed drastically. It’s not uncool to be the person with the big hat, the sunglasses, the long sleeve shirts, because at the end of the day, that person has a better chance of living a longer, healthier life,” Jane said.

The Minister for Health, Ryan Park, said the campaign will be hitting the airwaves and reaching out to workers and employers online, to dispel myths about the risks of skin cancer as well as provide simple and practical steps for workers and their employers to take to prevent it. The Minister for Work Health and Safety, Sophie Cotsis, urged employers and workers to make checking the UV index part of their morning routine before heading to work.

“If it’s high, then cover up and protect yourself. It only takes a few minutes to protect yourself from the harmful UV rays and it could save you a lifetime of battling skin cancer. Worker health and safety isn’t just about hardhats and harnesses, it is also about sun protection and avoiding overexposure to UV on the job,” Cotsis said.

The general rule is to protect your skin from the sun when the UV index is high, at 3 or above. Daily UV index levels can be monitored on the MyUV site. More information about the Change Your Routine campaign can be found here.

Image credit: iStock.com/sculpies","Outdoor workers are reportedly exposed to three times more UV radiation than indoor workers, with the Cancer Institute NSW urging people to take action to reduce their skin cancer risk.
“It’s a misconception that UV radiation is only harmful during summer, with high UV index levels present in NSW from August to May,” O’Brien said.
Australia reportedly has one of the highest skin cancer rates in the world, with two out of three Australians treated for skin cancer during their lifetime.
Professor O’Brien said UV radiation is a major workplace hazard and employers have a duty of care to protect their workers.
It only takes a few minutes to protect yourself from the harmful UV rays and it could save you a lifetime of battling skin cancer.",,https://www.nscafoundation.org.au/news
115,NSCA Foundation,Asset Media,"Spinal Health Week is the annual national campaign aimed at improving the spinal health of Australians of all ages, taking place from 22–28 May 2023. Conducted by the Australian Chiropractors Association (ACA), the 2023 campaign will focus on the causes of headaches and the negative effects headaches are having on families, workers and the Australian economy.

With more than seven million Australians suffering from debilitating tension headaches, and more than 4.9 million suffering chronic migraine, the economic impact to Australia exceeds $35.7 billion annually. However, the real cost to headache sufferers is the burden of headaches impacting their quality of life — robbing sufferers of essential relaxation, social activities and time with family and friends, as well as limiting productivity at home, work and school.

Migraine and tension headaches are the most common headache disorders, but there are many types of headaches and many triggers that can cause them, with some of the most common causes being stress (at home, work and school) and spinal health conditions. Headaches relating to spinal health conditions can be cervicogenic (neck-related) while tension headaches and migraines can be triggered by neck and spinal problems.

Consulting a chiropractor and determining if headaches are related to spinal health problems is an important step in effective management of most headaches with the best outcomes being a holistic approach encompassing stress management, good posture, regular exercise, rest and a healthy diet.

During national Spinal Health Week 2023, the ACA will tackle spine-related headaches by increasing awareness of the painful condition and improving spinal health through effective drug-free solutions that limit the impact headaches have on the quality of life of over 46% of Australians.

Image credit: iStock.com/golfcphoto","Spinal Health Week is the annual national campaign aimed at improving the spinal health of Australians of all ages, taking place from 22–28 May 2023.
Conducted by the Australian Chiropractors Association (ACA), the 2023 campaign will focus on the causes of headaches and the negative effects headaches are having on families, workers and the Australian economy.
With more than seven million Australians suffering from debilitating tension headaches, and more than 4.9 million suffering chronic migraine, the economic impact to Australia exceeds $35.7 billion annually.
Headaches relating to spinal health conditions can be cervicogenic (neck-related) while tension headaches and migraines can be triggered by neck and spinal problems.
During national Spinal Health Week 2023, the ACA will tackle spine-related headaches by increasing awareness of the painful condition and improving spinal health through effective drug-free solutions that limit the impact headaches have on the quality of life of over 46% of Australians.",,https://www.nscafoundation.org.au/news
