,Title,Authors,Text,Summary,published_date,Source
155,NSCA Foundation,Asset Media,"Wage Inspectorate Victoria has launched a range of online learning resources as part of a pilot program to increase awareness and understanding of Victoria’s long service leave and wage theft laws. The free e-learning modules for employers and workers aim to improve understanding of and compliance with workplace rights and obligations.

Taking less than 15 minutes to complete, the modules will be trialled over the coming months to test the effectiveness of e-learning to embed knowledge about workplace laws, with more topics to be added if the pilot is successful. After finishing the courses, users are encouraged to complete a short survey to provide their feedback and rate the extent to which their knowledge about long service leave and wage theft has improved. Robert Hortle, Commissioner of Wage Inspectorate Victoria, said the e-learning resources provide another avenue for employers and workers to learn about the law, and are part of the Wage Inspectorate’s commitment to trialling different ways of improving compliance with the law.

“We know there is a variety of learning preferences out there, and that’s why we provide support through multiple channels — we have fact sheets, videos, frequently asked questions, a helpline and now online learning. Being informed is the first step to being compliant,” Hortle said.

Designed with stakeholder input, and accessibility in mind, the modules feature audio and interactive elements to provide an overview of the law and allow practitioners or people with specific questions to jump to topics they need help with. The long service leave module deals with topics like determining when Victoria’s Long Service Leave Act applies, how leave accrues and when it can be taken. It also covers how workers can recoup money they’re owed and resolve issues with their boss.

The wage theft modules address the legal definition of wage theft, how to address wage theft, the process of reporting it and the support available from the Wage Inspectorate. An employer-focused module provides information on who can be liable for wage theft offences and can help organisations understand their role in preventing a corporate culture that could lead to a wage theft offence being tolerated.

In November 2022, the Wage Inspectorate filed wage theft charges against a Macedon restaurant and its officer, making the first criminal wage theft charges filed under the Victorian Wage Theft Act 2020. In 2022, more than 280,000 Victorians accessed educative information on the Wage Inspectorate’s website. More than 12,000 people also called the regulator and their questions helped to inform the content for the new e-learning modules. “Visits to our website over the past year have demonstrated strong demand for online learning, and we hope to attract even more visitors with these new resources,” Hortle said.

Wage Inspectorate Victoria promotes and enforces Victorian law covering wage theft, child employment, long service leave and contractors in transport and forestry.","The free e-learning modules for employers and workers aim to improve understanding of and compliance with workplace rights and obligations.
The long service leave module deals with topics like determining when Victoria’s Long Service Leave Act applies, how leave accrues and when it can be taken.
The wage theft modules address the legal definition of wage theft, how to address wage theft, the process of reporting it and the support available from the Wage Inspectorate.
An employer-focused module provides information on who can be liable for wage theft offences and can help organisations understand their role in preventing a corporate culture that could lead to a wage theft offence being tolerated.
In November 2022, the Wage Inspectorate filed wage theft charges against a Macedon restaurant and its officer, making the first criminal wage theft charges filed under the Victorian Wage Theft Act 2020.",,https://www.nscafoundation.org.au/news
156,NSCA Foundation,Asset Media,"Truck drivers and members of the freight industry have been encouraged to participate in consultation to improve heavy vehicle rest stops across New South Wales. Minister for Regional Transport and Roads Sam Farraway said the initiative is important because it will help the NSW Government address gaps in the rest stop network and ensure facilities meet the needs of drivers.

“The road freight industry is critical to our state’s economy, from big business and farmers to retailers and consumers. We all rely on these drivers to ensure our goods get to us quickly and efficiently. It is important that we provide quality facilities that support heavy vehicle drivers and improve road safety. Up north in Clybucca we have installed outdoor fitness equipment for truckies to use so they can stretch and get exercise in after a long period on the road,” Farraway said.

Farraway forecasts that the NSW freight task is expected to grow by 34% in 2061, with the state government doing everything to support this growth by ensuring that the supply chain is efficient. “We want to hear from the road freight industry, particularly heavy vehicle drivers on what they need and expect at rest stops across NSW and where additional facilities are needed. We have several projects underway investigating, planning, designing and constructing heavy vehicle rest stop improvements. Industry feedback is guiding this work to ensure it meets the current and future needs of heavy vehicle drivers and the growing freight task,” Farraway said.

The Livestock, Bulk and Rural Carriers Association President Wade Lewis welcomed the progression of the NSW Heavy Vehicle Rest Stop program, which aims to provide new and upgraded rest areas for heavy vehicles on key freight routes in NSW. Lewis said the program highlights the NSW Government’s commitment to engage with industry to develop a practical and capable rest area network.

“Rest areas are a vital component of the heavy vehicle task and support drivers to manage fatigue and comply with driving hours regulation,” Lewis said.

Consultation will be open until 28 February 2023. To provide feedback, visit: https://www.haveyoursay.nsw.gov.au/heavy-vehicle-rest-stopslaunch.","Truck drivers and members of the freight industry have been encouraged to participate in consultation to improve heavy vehicle rest stops across New South Wales.
“The road freight industry is critical to our state’s economy, from big business and farmers to retailers and consumers.
It is important that we provide quality facilities that support heavy vehicle drivers and improve road safety.
We have several projects underway investigating, planning, designing and constructing heavy vehicle rest stop improvements.
“Rest areas are a vital component of the heavy vehicle task and support drivers to manage fatigue and comply with driving hours regulation,” Lewis said.",,https://www.nscafoundation.org.au/news
157,NSCA Foundation,Asset Media,"The NSW Government’s Centre for Work Health and Safety has released a set of guidelines for working safely with collaborative robots (cobots), developed in partnership with the Centre for Advanced Manufacturing, University of Technology Sydney, Robotics Institute, Centre for Inclusive Design, and Kairos Now.

Head of SafeWork NSW Natasha Mann said that despite the rising usage of cobots and the risks involved, there is a gap in the current workplace health and safety framework around how workplaces can safely engage with them. “The potential WHS risks cobots present are reasonably well-known overseas, with several cases of workers being injured in cobot-related incidents. The world-first guidelines directly address this gap by offering practical guidance for preventing robot-related injuries from occurring, and in turn, curbing potential WHS incidents in the future,” Mann said.

The guidelines offer easy-to-adopt strategies and resources to plan and design cobot-safe workplaces, mitigate hazards and minimise harm, and are designed to be used on a strategic level for business and an operational level for workers. The guidelines are part of a research project to identify the key risks of working with cobots, and develop a set of practical guidelines for working safely with them.

“The research informing the guidelines included identifying WHS risks of working with cobots, a study to explore human attitudes and perceptions about how safe design can be supported and enabled, and co-design sessions to support safe implementation,” Mann said.

The Guidelines for Safe Collaborative Robot Design and Implementation are freely available to download here.","“The potential WHS risks cobots present are reasonably well-known overseas, with several cases of workers being injured in cobot-related incidents.
The world-first guidelines directly address this gap by offering practical guidance for preventing robot-related injuries from occurring, and in turn, curbing potential WHS incidents in the future,” Mann said.
The guidelines are part of a research project to identify the key risks of working with cobots, and develop a set of practical guidelines for working safely with them.
“The research informing the guidelines included identifying WHS risks of working with cobots, a study to explore human attitudes and perceptions about how safe design can be supported and enabled, and co-design sessions to support safe implementation,” Mann said.
The Guidelines for Safe Collaborative Robot Design and Implementation are freely available to download here.",,https://www.nscafoundation.org.au/news
158,NSCA Foundation,Asset Media,"Concreters across New South Wales have been reminded to incorporate regular inspections, maintenance and testing of equipment into their routines, following a spate of concrete placing equipment incidents. Acting Head of SafeWork NSW John Tansey said concrete pours are hazardous operations and concrete placing equipment including concrete pumps must be serviced and functioning properly before any work starts. Between 2017 and 2020, SafeWork NSW Inspectors attended approximately 60 incidents, including one fatality and a further 17 involving serious injuries, many of which were caused by malfunctioning concrete placing equipment.

“Recently there have been multiple occurrences of workers being injured by concrete line hose which has either blocked or burst and expelled concrete at significant force, as well as equipment impacting with powerlines, scaffolding and other infrastructure,” Tansey said.

During a pour at a site in Wagga, a concrete pump connection point burst after a blockage and a member of the public’s car was sprayed with concrete as they drove past the site. In another incident at Greystanes, a boom pump extension arm hit overhead powerlines and caused an arc explosion and current which travelled along a boundary fence and blew a neighbouring property’s water main.

“It is very lucky nobody was seriously injured during these events and a timely reminder that working with concrete can be dangerous. Before work commences it is essential workers verify if the terrain is suitable for concrete placing equipment operations and note hazards such as overhead powerlines and recent trenching. Always ensure you have safe work systems in place and that anyone performing high-risk work is adequately licensed, trained and supervised when doing so,” Tansey said.

To read safety information for building and construction industry workers, click here. To access a fact sheet about concrete placing equipment operations, click here. To report unsafe work, download the Speak Up Save Lives app or call SafeWork NSW on 13 10 50.","Concreters across New South Wales have been reminded to incorporate regular inspections, maintenance and testing of equipment into their routines, following a spate of concrete placing equipment incidents.
Acting Head of SafeWork NSW John Tansey said concrete pours are hazardous operations and concrete placing equipment including concrete pumps must be serviced and functioning properly before any work starts.
Between 2017 and 2020, SafeWork NSW Inspectors attended approximately 60 incidents, including one fatality and a further 17 involving serious injuries, many of which were caused by malfunctioning concrete placing equipment.
To access a fact sheet about concrete placing equipment operations, click here.
To report unsafe work, download the Speak Up Save Lives app or call SafeWork NSW on 13 10 50.",,https://www.nscafoundation.org.au/news
159,NSCA Foundation,Asset Media,"People who are off work due to injury or illness are at higher risk of later suicide and intentional self-harm, according to an international study by Monash University School of Public Health and Preventative Medicine. Researchers collated findings from 47 studies published over 20 years from 16 different countries to examine the relationship between a disabling work injury or illness and later suicide or self-harm.

Published in PLOS Global Public Health, the review found that the risk of suicide was elevated in people with workers compensation claims, on long-term sick leave and receiving disability pensions. Lead researcher Professor Alex Collie said this suggests a need for governments and employers to focus on identifying workers at greatest risk of suicide and put more effort into suicide prevention.

“We found consistent evidence of a link between being off work sick or injured and later suicide. We see this link in many countries and in people with different types of health conditions,” Collie said.

Of the 47 studies included in the review, 44 found that people with work injury or illness were at greater risk of suicide or self-harm, with one study showing a protective relationship and two showing no relationship. Researchers also found a number of things that increase the risk of suicide, such as being off work for a long time, younger age, living alone, having a history of poor health or a mental health condition. People who had very long periods off work were at much higher risk; being out of work with injury or illness for weeks, months or years was linked with an increased risk of suicide and self-harm.

“But time away from work doesn’t necessarily reflect the severity of injury or illness. It may also indicate that the person has received poor quality medical treatment, has delayed seeking help or has other behaviours that can affect recovery such as substance misuse,” Collie said.

The review’s authors suggest that programs and services designed to reduce the duration of time off work may also reduce the risk of suicide and self-harm. Collie said that suicide prevention should not be left just to the healthcare system, adding that there are opportunities through systems that support sick or injured workers, like workers compensation and social security, to identify people who are at higher risk and to provide supports and services that reduce those risks.

“When it comes to reducing time off work, we know what good interventions look like. This review adds another dimension and suggests by supporting sick and injured workers to return to work, we may also be able to reduce the risk of suicide,” Collie said.

The researchers also identified some gaps in the research literature — only two Australian studies were identified and there were no studies of suicide prevention interventions.","Researchers collated findings from 47 studies published over 20 years from 16 different countries to examine the relationship between a disabling work injury or illness and later suicide or self-harm.
“We found consistent evidence of a link between being off work sick or injured and later suicide.
We see this link in many countries and in people with different types of health conditions,” Collie said.
This review adds another dimension and suggests by supporting sick and injured workers to return to work, we may also be able to reduce the risk of suicide,” Collie said.
The researchers also identified some gaps in the research literature — only two Australian studies were identified and there were no studies of suicide prevention interventions.",,https://www.nscafoundation.org.au/news
160,NSCA Foundation,Asset Media,"Construction workers, manufacturers and factory operators across a range of industries in New South Wales can now renew their High Risk Work Licence online, saving time and money and allowing them to get back to work faster. The High Risk Work Licence can be renewed electronically via MyServiceNSW Accounts on the Service NSW website.

Minister for Customer Service and Digital Government Victor Dominello said more than 5300 customers renew a High Risk Work Licence every month, and that the new initiative will save customers 90 minutes per renewal application by removing the need for in-person lodgement at Australia Post — this could be worth almost 100,000 hours to the economy and save customers a collective $370,000 each month.

“Customers can now log in using their MyServiceNSW Account to renew their licence online. As a result of the new online renewal process, customers will be able to re-use their existing licence photo and not require a new photo every time,” Dominello said.

High Risk Work Licence holders will receive email or SMS notifications advising them they can now renew through this new digital process. In-person renewals are still available as a non-digital option and customers can contact SafeWork NSW on 13 10 50 to obtain a form. Customers can also add the Digital High Risk Work Licence to their Service NSW app, which is available for all current licence holders with a MyServiceNSW account.

A High Risk Work Licence must be renewed every five years by SafeWork NSW to operate some machinery, work with scaffolding and undertake rigging. More than 49,000 customers have activated Digital High Risk Work Licences since going live in June 2022; the licensing program has also provided digital trade licences for more than 40 licence categories, with the aim of improving customer service, providing convenience and making compliance with legislation easier.","The High Risk Work Licence can be renewed electronically via MyServiceNSW Accounts on the Service NSW website.
“Customers can now log in using their MyServiceNSW Account to renew their licence online.
High Risk Work Licence holders will receive email or SMS notifications advising them they can now renew through this new digital process.
Customers can also add the Digital High Risk Work Licence to their Service NSW app, which is available for all current licence holders with a MyServiceNSW account.
A High Risk Work Licence must be renewed every five years by SafeWork NSW to operate some machinery, work with scaffolding and undertake rigging.",,https://www.nscafoundation.org.au/news
