,Title,Authors,Text,Summary,published_date,Source
58,NSCA Foundation,Asset Media,"Recent findings suggest the prevalence of poor mental health in the mining industry is high and the risk of psychological distress in remote mining was significantly higher among workers aged 44 years or under and has increased in the past six years compared to all other industries.1. 2. 3.

There are a number of mental health problems unique to the Mining and Quarry Industry, whose cause is directly influenced by the work involved, examples being the hazardous environment, work organisation (shift work schedules, fly-in fly-out, compressed roster swings), interpersonal relations (work-family conflicts), psychosocial risk at work (high job demand, job stress), wellbeing (quality of life, job satisfaction) and substance abuse. A perceived culture of incivility within a team or worksite is also linked to poorer mental health, as well as a higher frequency and severity of aggressive, bullying or harassment and sexual violence workplace behaviours.

The AR Interactive - Mining & Quarry Industry Guide to Workplace Safety 2023/24 produced in conjunction with industry partnering Associations, Mates in Mining, Australian Resources and Energy Employer Association (AREEA), Minerals Industry Safety & Health Centre (MISHC) and endorsed by the NSCA Foundation assists in recognising and controlling the key hazards and risks associated in the Mining and Quarry Industry, with the latest WHS Regulatory Guidelines and Framework focused on proactive prevention of injury, ill-health and essential information in order to help create a workplace safety culture of Zero Harm.

Mental Health and Support is a primary focus viewed through the framework of risk management, protecting all workers from psychological workplace hazards in light of the model Work Health and Safety (WHS) Laws that now include regulations on psychosocial hazards and a new model Code of Practice Managing Psychosocial Hazards at Work.

Designed to be displayed in the workplace the AR Interactive — Mining & Quarry Industry Guide to Workplace Safety 2023/24 available via free subscription at www.provisual.com.au is developed with interactive augmented reality (AR) capabilities for use with a smart device, by simply downloading the free Pro-Vis AR Safety App via the App Store or Google Play. Download the Pro-Vis AR Safety App to view videos on managing your mental health:

Mineral Resources Limited Managing Mental Health is a Sign of Strength & RUOK? Balance and Perspective are Keys to Feeling OK videos

Fosterville Gold Mine Mates ask Mates “RUOK?” video

Together Pro-Visual Publishing, AREEA & MISHC have carefully selected additional subject matter that addresses issues pertinent to this industry following in-depth sector feedback which includes:

Impact of Aggressive Workplace Behaviour: Overview, Risk Management & Control Measures. Download the Pro-Vis AR Safety App to access resources:

Safe Work Australia Preventing Workplace Violence and Aggression Information Sheet

Safe Work Australia ‘Dealing with Workplace Bullying — A Worker’s Guide’

Fair Work Ombudsman Bullying, Sexual Harassment and Discrimination at Work link to landing page

Safe work procedures and control measures outline the potential risks of working on or near hydraulic equipment and the likely consequences of hydraulic failure & hose leaks. Download the Pro-Vis AR Safety App to view:

‘Learning from Investigations’ videos using hydraulic equipment

NSW Resources Regulator Worker injured after being trapped underneath a loader cab & Worker crushed by opal mine material hoist bucket Videos

Safety in Small Mines, Open Pits & Quarries: Safety Management System overview which features NSW Resources Regulator Safety Management Kit for Small-scale Mines, Quarries and Extractive Industry Operations instructions, templates & assessment documents adapted to medium size operations. Download the Pro-Vis AR Safety App to view videos on safety during mining and quarry operations:

NSW Resources Regulator Dangerous blasting incident at Albury Quarry & Maules Creek Mine truck collision Videos

NSW Mining Yancoal Moolarben Coal Operations Safety Light [2016 NSW Mining HSEC Awards] Video

Working in Extreme Heat: Risk Assessment; Control Measures and Heat Related Illness Symptoms. Downloadable resources via Pro-Vis Safety App include:

Safe Work Australia Solar Ultraviolet Radiation Managing the Risks Fact Sheet & Managing the Risks of Working in Heat Guidance Material

First Aid Fact Sheet & Cancer Council SunSmart App

Pro-Visual Publishing CEO John Hutchings states, “The success of the AR Interactive — Mining & Quarry Industry Guide to Workplace Safety cannot be achieved without the collective feedback from the Mining and Quarry sector, peak industry Associations and corporate sponsors.

WHS training and education initiatives have been shown to be effective in supporting workers’ mental health and wellbeing and the prevention of aggressive workplace behaviour. Team/worksite culture that prioritises mental health, such as through implementing and encouraging employees to engage in mental health initiatives, is linked to better mental health outcomes for miners, such as a higher likelihood of seeking both formal and informal supports.”

For free Guides email: marketing@provisual.com.au or visit: https://www.provisual.com.au/free-guide-subscription.html.

1. Medical Journal of Australia Psychological distress in remote mining & construction workers in Australia, 2018

2. Duncan, A., Kalsi, J., & Mavisakalyan, A. (2022). Towards a healthy and safe workplace in the mining industry

3. The Mental Awareness, Respect and Safety (MARS) Landmark Study Western Australian Government, Oct 2022

Click here for a clearer image.","A perceived culture of incivility within a team or worksite is also linked to poorer mental health, as well as a higher frequency and severity of aggressive, bullying or harassment and sexual violence workplace behaviours.
Download the Pro-Vis AR Safety App to view videos on managing your mental health:Mineral Resources Limited Managing Mental Health is a Sign of Strength & RUOK?
WHS training and education initiatives have been shown to be effective in supporting workers’ mental health and wellbeing and the prevention of aggressive workplace behaviour.
Team/worksite culture that prioritises mental health, such as through implementing and encouraging employees to engage in mental health initiatives, is linked to better mental health outcomes for miners, such as a higher likelihood of seeking both formal and informal supports.”For free Guides email: marketing@provisual.com.au or visit: https://www.provisual.com.au/free-guide-subscription.html.
The Mental Awareness, Respect and Safety (MARS) Landmark Study Western Australian Government, Oct 2022Click here for a clearer image.",,https://www.nscafoundation.org.au/news
59,NSCA Foundation,Asset Media,"The ‘HEART 5’ mobile health unit that travels around Queensland offering free lung checks for retired and former Queensland mine and quarry workers will be in Mount Isa from 18–20 September 2023. The truck will provide free screening for former workers to help detect mine dust lung diseases like black lung and silicosis. Early detection enables former workers in remote and regional areas to access support and treatment.

HEART 5 is fully equipped with medical equipment to provide a thorough assessment that includes a lung function test and chest X-ray, and when required, follow-up tests such as high-resolution CT scans. The service is operated by Heart of Australia in partnership with the mining industry’s independent regulator Resources Safety and Health Queensland (RSHQ) and the Queensland Government.

Dean Barr, RSHQ’s Executive Director of Occupational Health, said mine dust lung diseases can take up to 10 years or more to develop, and even longer to produce noticeable symptoms. “We know that prevention is the best defence; however, identifying the disease in its early stages can prevent it from progressing to a point where it seriously impacts your quality of life. I strongly urge all former workers to get a free lung check,” Barr said.

Since its launch in February 2022, free checks aboard HEART 5 have detected 57 cases of mine dust lung disease diagnosed in former workers. Bookings are essential and can be made through the Mine Dust Health Support Service by emailing info@minedusthealthsupport.com or calling 1300 445 715.

Applicants must no longer work in the industry and have at least three years’ experience in coalmines, mineral mines or quarries. Former workers are entitled to one free check every five years. Free checks are also available at local RSHQ-approved doctors, and in many cases, RSHQ can cover the travel costs.

Image credit: iStock.com/Jan-Otto","The truck will provide free screening for former workers to help detect mine dust lung diseases like black lung and silicosis.
I strongly urge all former workers to get a free lung check,” Barr said.
Since its launch in February 2022, free checks aboard HEART 5 have detected 57 cases of mine dust lung disease diagnosed in former workers.
Bookings are essential and can be made through the Mine Dust Health Support Service by emailing info@minedusthealthsupport.com or calling 1300 445 715.
Free checks are also available at local RSHQ-approved doctors, and in many cases, RSHQ can cover the travel costs.",,https://www.nscafoundation.org.au/news
60,NSCA Foundation,Asset Media,"Australia Post has urged Australians to keep an eye out for postal workers, after data revealed that a postie is injured by a third party on the roads at least once a week. In the past financial year, 65 postal workers sustained serious injuries as a result of third-party traffic accidents, including broken limbs, concussions and lacerations, with many resulting in hospital stays, time off work and psychological trauma. Across the country, New South Wales recorded the highest number of accidents involving postal workers.

Some of the most common third-party accidents involving posties included drivers not looking when using, or speeding through, roundabouts, failing to stop at a Stop or Give Way sign, driving distracted by a mobile phone or failing to leave enough space to stop safely.

To help protect postal workers, Australia Post has implemented safety measures, including installing telematics (video and data) across thousands of its electric delivery vehicles (eDVs), motorcycles, vans and trucks. High-vis uniforms, intensive road safety training for all posties, sensors and duress buttons on eDVs (which pinpoint the location of a postie in an emergency) are also standard across the network.

Australia Post General Manager (Safety and Wellbeing) Rod Maule said that even one vehicle-related incident is too many, with postal workers often sustaining injuries from being knocked off their vehicle or swerving off the road to avoid a more serious incident from occurring. Maule urged all drivers to be alert and keep an eye out for posties, particularly over the next few months as deliveries increase in the lead-up to Christmas.

“While we want our team to deliver for all Australians, we also want each of them to safely get home to their families at the end of the day. Safety is our number one priority, which is why we’ve invested millions of dollars into advanced technology and training to keep our team safe on the road,” Maule said.","Across the country, New South Wales recorded the highest number of accidents involving postal workers.
To help protect postal workers, Australia Post has implemented safety measures, including installing telematics (video and data) across thousands of its electric delivery vehicles (eDVs), motorcycles, vans and trucks.
High-vis uniforms, intensive road safety training for all posties, sensors and duress buttons on eDVs (which pinpoint the location of a postie in an emergency) are also standard across the network.
Maule urged all drivers to be alert and keep an eye out for posties, particularly over the next few months as deliveries increase in the lead-up to Christmas.
Safety is our number one priority, which is why we’ve invested millions of dollars into advanced technology and training to keep our team safe on the road,” Maule said.",,https://www.nscafoundation.org.au/news
61,NSCA Foundation,Asset Media,"Research has found that fly-in, fly-out (FIFO) shift workers are particularly sleep-deprived and at risk of developing sleep disorders. Now, Edith Cowan University (ECU) is investigating what can be done to improve FIFO workers’ wellbeing by conducting a study that looks at where remote workers in the resources industry are sleeping to see how it impacts their quality of sleep.

The ECU researchers are calling for participants to take part in an online survey, where they can also offer to participate in another study in which workers will wear a sleep tracker to bed and have a light/temperature data logger placed nearby.

ECU PhD candidate and lead researcher Philipp Beranek said it is vital to investigate what can be done to improve resources workers’ sleep health.

“Sleep is a paramount physiological state for health and performance while we’re awake. We know resources workers experience sleep difficulties; therefore, investigating modifiable factors which impact sleep is crucial. Our main aim is to investigate the relationship between the sleep environment and the sleep of shift workers in the sector,” Beranek said.

ECU previously conducted a study on the sleeping habits of FIFO shift workers in which 60% of participants were at risk of developing sleep disorders such as obstructive sleep apnoea and shift work disorder. Beranek said adequate sleep is especially important in an industry as potentially hazardous as the resources sector, as sleep loss can negatively affect mood, the immune system and cognitive functioning such as attention and memory.

“It can also result in increased risk of workplace accidents, increased absenteeism and reduced job satisfaction and team effectiveness, with financial consequences for employees and employers. The sleep environment has been identified as a crucial element in fatigue risk management and initial studies in other populations indicate sleep environment factors such as light and temperature can negatively impact sleep. To date, no study has investigated the sleep environment and its influence on the sleep of shift workers in extractive industries; our study is designed to close this gap,” Beranek said.

ECU’s previous research found that FIFO shift workers accumulate ‘sleep debt’ while working onsite, before they then return home. While it’s assumed this would allow workers to catch up on sleep, Beranek said the impacts of sleep debt could continue to be felt after returning home, as accumulated sleep loss can increase the risk of poor mental health and cardiovascular health.

“We also want to find out if workers’ sleep does actually improve once they’re in their own bed: do they have children waking them up, noisy neighbours, social commitments keeping them from getting enough sleep?” Beranek said.

Study participants will monitor their sleep environments during their time off work, with the research findings used to help improve the sleep health of workers in the resources sector, and the broader public.

“Research from the Sleep Health Foundation found inadequate sleep cost Australia $66.3 billion in 2016–17 — so it’s a major issue, not just in the resources sector. Improving this situation is in everyone’s interests, so we are expecting this research to lead to individual and organisational changes for the better,” Beranek said.

Image credit: iStock.com/dusanpetkovic","ECU PhD candidate and lead researcher Philipp Beranek said it is vital to investigate what can be done to improve resources workers’ sleep health.
We know resources workers experience sleep difficulties; therefore, investigating modifiable factors which impact sleep is crucial.
Our main aim is to investigate the relationship between the sleep environment and the sleep of shift workers in the sector,” Beranek said.
ECU’s previous research found that FIFO shift workers accumulate ‘sleep debt’ while working onsite, before they then return home.
“Research from the Sleep Health Foundation found inadequate sleep cost Australia $66.3 billion in 2016–17 — so it’s a major issue, not just in the resources sector.",,https://www.nscafoundation.org.au/news
62,NSCA Foundation,Asset Media,"WorkSafe Western Australia has commenced an inspection program to look at safety issues in the state’s aged care and residential care facilities. The program will look at a number of randomly selected facilities across metropolitan and regional areas of the state throughout the 2023/24 financial year. Inspectors will prioritise industry-specific hazards, along with workplace violence and aggression, staff training and other issues.

Residential aged care has been identified as an industry with significant challenges in relation to workplace violence and aggression and a high number of injuries due to manual handling and slips, trips and falls. The inspections will be conducted with a checklist to ensure consistency across all workplaces.

WorkSafe Deputy Commissioner Sally North said the proactive inspection program aims to help employers in the aged care industry fulfil their responsibilities for the health and safety of workers in their facilities. The inspection program will also provide information and collaboratively work towards a reduction in work-related injuries and illnesses in the targeted sectors.

“However, if our inspectors find non-compliance with work health and safety legislation, they will take appropriate action that could include the issuing of verbal directions or notices requiring the facility to remedy the situation. A wide range of safety issues may be present for workers in the aged care industry, and it’s our aim to make employers fully aware of the risks and supply them with information on the measures that can be put into place to lessen those risks,” North said.

WorkSafe has an extensive schedule of inspection programs that examine safety issues in a range of industries and activities.

Image credit: iStock.com/PeopleImages","WorkSafe Western Australia has commenced an inspection program to look at safety issues in the state’s aged care and residential care facilities.
The program will look at a number of randomly selected facilities across metropolitan and regional areas of the state throughout the 2023/24 financial year.
WorkSafe Deputy Commissioner Sally North said the proactive inspection program aims to help employers in the aged care industry fulfil their responsibilities for the health and safety of workers in their facilities.
The inspection program will also provide information and collaboratively work towards a reduction in work-related injuries and illnesses in the targeted sectors.
WorkSafe has an extensive schedule of inspection programs that examine safety issues in a range of industries and activities.",,https://www.nscafoundation.org.au/news
63,NSCA Foundation,Asset Media,"WorkSafe Victoria has extended its partnership with the Alfred Occupational Respiratory Clinic to provide free health screening for Victorian workers at risk of the lung disease silicosis. More than 600 stonemasons have now had a comprehensive health assessment and received their diagnosis at The Alfred since it was launched in July 2021.

Workers can access a range of diagnostic tools and specialists during a single day at the clinic, increasing the likelihood of early-stage diagnosis and reducing the stress of multiple visits. WorkSafe Executive Director of Health and Safety Narelle Beer said the partnership with The Alfred to deliver a dedicated public hospital occupational respiratory clinic has been extended until July 2026. “This clinic plays such a crucial role in the health journey of so many Victorian workers facing an uncertain future and this ongoing collaboration will see that world-class care continue,” Beer said.

WorkSafe supports the clinic by taking calls from workers, families and employers before completing referrals for eligible workers and providing assistance with any claim lodgements. Many of WorkSafe’s past and present stonemasons had registered with WorkSafe’s own free silica health screening program, which commenced in May 2019 and supported more than 1100 workers. WorkSafe has now received 630 silicosis-related compensation claims following a positive diagnosis. Beer said there is much more work to be done to better understand the impacts of engineered stone and to increase the quality of life of injured workers.

“We will continue to do everything within our power to ensure employers are reducing the risks to health and safety and continue to hold them to account when they fail to protect their workers,” Beer said.

Victorian employers in the stonemason industry can use the free assessment at The Alfred to meet their health monitoring duties under the Occupational Health and Safety Act and Occupational Health and Safety Regulations. To confirm eligibility and book an appointment, call WorkSafe’s Silica Advisors on 1800 136 089 (option 1 then option 3) for a referral.

Image credit: iStock.com/simonkr","WorkSafe Victoria has extended its partnership with the Alfred Occupational Respiratory Clinic to provide free health screening for Victorian workers at risk of the lung disease silicosis.
More than 600 stonemasons have now had a comprehensive health assessment and received their diagnosis at The Alfred since it was launched in July 2021.
WorkSafe supports the clinic by taking calls from workers, families and employers before completing referrals for eligible workers and providing assistance with any claim lodgements.
Victorian employers in the stonemason industry can use the free assessment at The Alfred to meet their health monitoring duties under the Occupational Health and Safety Act and Occupational Health and Safety Regulations.
To confirm eligibility and book an appointment, call WorkSafe’s Silica Advisors on 1800 136 089 (option 1 then option 3) for a referral.",,https://www.nscafoundation.org.au/news
